{
  "skill": "instruction-count-first",
  "version": "0.1.0",
  "suite": "core_optimization_suite",
  "run_at": "2026-06-10T14:52:56+00:00",
  "runner": "run_evals",
  "metrics": {
    "pass_rate": 0.6667,
    "n_cases": 9,
    "mean_score": 0.7333
  },
  "per_case": [
    {
      "case_id": "hh-flush",
      "pass": true,
      "score": 1.0
    },
    {
      "case_id": "hh-submit",
      "pass": true,
      "score": 1.0
    },
    {
      "case_id": "hh-write",
      "pass": true,
      "score": 1.0
    },
    {
      "case_id": "mm-kswapd",
      "pass": false,
      "score": 0.2
    },
    {
      "case_id": "mm-rmqueue",
      "pass": false,
      "score": 0.2
    },
    {
      "case_id": "mm-shrink-node",
      "pass": false,
      "score": 0.2
    },
    {
      "case_id": "wq-pool",
      "pass": true,
      "score": 1.0
    },
    {
      "case_id": "wq-pwq",
      "pass": true,
      "score": 1.0
    },
    {
      "case_id": "wq-worker",
      "pass": true,
      "score": 1.0
    }
  ]
}